{
  "schemaId": "studywithme-bg.learncard.v1",
  "deckKey": "learncard-target-reference-01",
  "bookKey": "learncard-target-reference",
  "meta": {
    "title": {
      "en": "learncard-target.v1 reference deck"
    },
    "description": {
      "en": "One card of every shape the engine must parse: single-answer mcq, true/false (sourceFormat), multiple-select (selectionMode), and flashcard. Generated by the screen-to-learn exporter, so it cannot drift from real output."
    },
    "level": "general",
    "tags": [
      "reference",
      "learncard-target"
    ],
    "difficulty": "intermediate",
    "estimatedMinutes": 4,
    "cardCount": 4,
    "languages": {
      "source": "en",
      "target": "en"
    },
    "source": {
      "kind": "synthetic-fixture",
      "rightsBasis": "user-authored"
    }
  },
  "cards": [
    {
      "cardId": "q-0001",
      "type": "mcq",
      "sourceId": "src_9ba85ff241e8a10da8a57e55ed53d0f6",
      "question": {
        "en": "Through which medium does light travel fastest?"
      },
      "correctAnswer": "Vacuum",
      "options": [
        {
          "text": "Liquid water",
          "isCorrect": false
        },
        {
          "text": "Borosilicate glass",
          "isCorrect": false
        },
        {
          "text": "Vacuum",
          "isCorrect": true
        },
        {
          "text": "Diamond",
          "isCorrect": false
        }
      ],
      "scoring": {
        "mode": "single-best-answer",
        "points": 1
      }
    },
    {
      "cardId": "q-0002",
      "type": "mcq",
      "selectionMode": "multiple",
      "sourceId": "src_9aee0e0c9d6a1e9c8684cc83e45d279d",
      "question": {
        "en": "Which of the following are properties shared by all living organisms? Select all that apply."
      },
      "options": [
        {
          "optionId": "opt_3a17e062e6d607206176670fe1c1eb22",
          "text": "Cellular organization",
          "isCorrect": true
        },
        {
          "optionId": "opt_bdfd3a2344b2054ac7a65769baa87855",
          "text": "Ability to perform photosynthesis",
          "isCorrect": false
        },
        {
          "optionId": "opt_4d81b45ec4c60b72697128fdfbcd2ba2",
          "text": "Metabolism",
          "isCorrect": true
        },
        {
          "optionId": "opt_eb7551fed10060bec30d242b6afb50c4",
          "text": "Possession of a membrane-bound nucleus",
          "isCorrect": false
        },
        {
          "optionId": "opt_1d88082dbd82439be78622b1fe38e536",
          "text": "Response to stimuli",
          "isCorrect": true
        }
      ],
      "correctOptionIds": [
        "opt_3a17e062e6d607206176670fe1c1eb22",
        "opt_4d81b45ec4c60b72697128fdfbcd2ba2",
        "opt_1d88082dbd82439be78622b1fe38e536"
      ],
      "scoring": {
        "mode": "all-or-nothing",
        "points": 1.0
      }
    },
    {
      "cardId": "q-0003",
      "type": "mcq",
      "sourceFormat": "true-false",
      "sourceId": "src_388fb6fe8b8a9b8e4423d101637c7771",
      "question": {
        "en": "The nucleus is the largest organelle in most animal cells."
      },
      "correctAnswer": "True",
      "options": [
        {
          "text": "True",
          "isCorrect": true
        },
        {
          "text": "False",
          "isCorrect": false
        }
      ],
      "scoring": {
        "mode": "single-best-answer",
        "points": 1
      }
    },
    {
      "cardId": "q-0004",
      "type": "flashcard",
      "sourceId": "src_0df3e6d9691cfdcb230da810e8f53e48",
      "question": {
        "en": "What is the SI unit of electric charge?"
      },
      "front": {
        "en": "What is the SI unit of electric charge?"
      },
      "back": {
        "en": "The coulomb (C) — defined as one ampere-second (A·s)."
      }
    }
  ]
}
